{
  "stage_name": "init",
  "status": "SUCCESS",
  "exit_code": 0,
  "started_at": "2026-05-28T08:50:37+0000",
  "finished_at": "2026-05-28T08:50:37+0000",
  "duration_ms": 0,
  "log_file": "/builds/brik/node-minimal/.brik-logs/init-AlgJHm.log",
  "artifacts": [],
  "warnings": [],
  "errors": []
}
