{
  "stage_name": "deploy",
  "status": "SUCCESS",
  "exit_code": 0,
  "started_at": "2026-05-28T08:56:27+0000",
  "finished_at": "2026-05-28T08:56:27+0000",
  "duration_ms": 0,
  "log_file": "/builds/brik/node-deploy-k8s/.brik-logs/deploy-bOBmaC.log",
  "artifacts": [],
  "warnings": [],
  "errors": []
}
